{
  "check_id": "hardening-local-dev-host-20260518",
  "host_id": "local-dev-host",
  "status": "passing",
  "image_ref": "palimpsest/postgres-node:2026-05-18",
  "os_release": "Ubuntu 24.04 LTS",
  "kernel_version": "6.8.0",
  "postgres_major_min": 18,
  "container_runtime": "podman 5.0",
  "disk_encryption": true,
  "firewall_enabled": true,
  "unattended_upgrades": true,
  "last_patched_at": "2026-05-18T09:00:00Z",
  "checked_at": "2026-05-18T10:00:00Z",
  "error_message": null
}
